[
  {
    "route_id": "oak_leaf_demo_loop",
    "source_type": "gpx_import",
    "source_hash": "gpxsha256:oakleafdemo0001",
    "snapped_edge_sequence": [
      "osm_edge_1001",
      "osm_edge_1002",
      "osm_edge_1008",
      "osm_edge_1015"
    ],
    "elevation_profile_m": [188.2, 189.1, 191.0, 189.9, 187.5],
    "surface_profile": ["asphalt", "asphalt", "packed_gravel", "asphalt"],
    "distance_m": 12643.8,
    "region_version": "milwaukee-v0.1.0"
  }
]
